{"command":"restorecon","description":"Restore SELinux file security contexts","global_options":[{"short":"-R","long":"--recursive","description":"Recurse into directories"},{"short":"-n","long":"--no-change","description":"Do not change files"},{"short":"-v","long":"--verbose","description":"Verbose output"},{"short":"-F","long":"--force","description":"Force reset customizable contexts"},{"short":"-e","long":"--exclude","description":"Exclude path","takes_value":true,"value_type":{"type":"Directory"}},{"short":"-f","long":"--file","description":"Read paths from file","takes_value":true,"value_type":{"type":"File","data":{}}},{"short":"-h","long":"--help","description":"Show help"}],"arguments":[{"name":"path","multiple":true,"type":{"type":"File","data":{}}}]}
