{"command":"lvcreate","description":"Create an LVM logical volume","global_options":[{"short":"-n","long":"--name","description":"Logical volume name","takes_value":true,"value_type":{"type":"String"}},{"short":"-L","long":"--size","description":"Logical volume size","takes_value":true,"value_type":{"type":"String"}},{"short":"-l","long":"--extents","description":"Logical extents","takes_value":true,"value_type":{"type":"String"}},{"short":"-s","long":"--snapshot","description":"Create snapshot"},{"short":"-T","long":"--thin","description":"Create thin LV or pool"},{"short":"-y","long":"--yes","description":"Assume yes"},{"short":"-h","long":"--help","description":"Show help"}],"arguments":[{"name":"vg-or-origin","type":{"type":"Dynamic","data":{"provider":"lvm.volume_group"}}}]}
