{"command":"command","description":"Run command with shell function lookup suppressed","global_options":[{"short":"-p","description":"Use default PATH"},{"short":"-v","description":"Print command path or description"},{"short":"-V","description":"Print verbose command description"}],"arguments":[{"name":"command","type":{"type":"Command"}},{"name":"argument","multiple":true,"type":{"type":"String"}}]}
