{"command":"logger","description":"Enter messages into the system log","global_options":[{"short":"-p","long":"--priority","description":"Facility.priority","takes_value":true,"value_type":{"type":"Choice","data":["user.debug","user.info","user.notice","user.warning","user.err","auth.info","authpriv.notice","daemon.info","kern.warning","local0.info","local7.debug"]}},{"short":"-t","long":"--tag","description":"Log tag","takes_value":true,"value_type":{"type":"String"}},{"short":"-f","long":"--file","description":"Log file contents","takes_value":true,"value_type":{"type":"File","data":{}}},{"short":"-n","long":"--server","description":"Remote syslog server","takes_value":true,"value_type":{"type":"String"}},{"short":"-P","long":"--port","description":"Remote port","takes_value":true,"value_type":{"type":"Number"}},{"short":"-s","long":"--stderr","description":"Also log to stderr"},{"long":"--journald","description":"Write journald entry"},{"long":"--help","description":"Show help"}],"arguments":[{"name":"message","multiple":true,"type":{"type":"String"}}]}
