{
  "command": "flatpak",
  "description": "Flatpak package manager",
  "global_options": [
    { "long": "--user", "description": "Use user installation" },
    { "long": "--system", "description": "Use system installation" },
    { "long": "--installation", "description": "Named installation", "takes_value": true, "value_type": { "type": "String" } },
    { "short": "-h", "long": "--help", "description": "Show help" }
  ],
  "subcommands": [
    { "name": "install", "description": "Install application" },
    { "name": "update", "description": "Update applications", "arguments": [{ "name": "application", "multiple": true, "type": { "type": "Dynamic", "data": { "provider": "flatpak.application" } } }] },
    { "name": "uninstall", "aliases": ["remove"], "description": "Uninstall application", "arguments": [{ "name": "application", "multiple": true, "type": { "type": "Dynamic", "data": { "provider": "flatpak.application" } } }] },
    { "name": "run", "description": "Run application", "arguments": [{ "name": "application", "type": { "type": "Dynamic", "data": { "provider": "flatpak.application" } } }] },
    { "name": "info", "description": "Show application information", "arguments": [{ "name": "application", "type": { "type": "Dynamic", "data": { "provider": "flatpak.application" } } }] },
    { "name": "list", "description": "List installed refs" },
    { "name": "search", "description": "Search remotes" },
    { "name": "remote-add", "description": "Add remote" },
    { "name": "remote-list", "description": "List remotes" }
  ]
}
