{
  "command": "code",
  "description": "Visual Studio Code",
  "global_options": [
    {
      "short": "-n",
      "long": "--new-window",
      "description": "Open in new window"
    },
    {
      "short": "-r",
      "long": "--reuse-window",
      "description": "Open in existing window"
    },
    {
      "short": "-g",
      "long": "--goto",
      "description": "Open file at line:column"
    },
    {
      "short": "-d",
      "long": "--diff",
      "description": "Compare two files"
    },
    {
      "short": "-w",
      "long": "--wait",
      "description": "Wait for window to close"
    },
    {
      "long": "--add",
      "description": "Add folder to workspace"
    },
    {
      "long": "--install-extension",
      "description": "Install extension",
      "takes_value": true,
      "multiple": true
    },
    {
      "long": "--uninstall-extension",
      "description": "Uninstall extension",
      "takes_value": true,
      "multiple": true,
      "value_type": { "type": "Dynamic", "data": { "provider": "code.extension" } }
    },
    {
      "long": "--disable-extension",
      "description": "Disable an extension for this session",
      "takes_value": true,
      "multiple": true,
      "value_type": { "type": "Dynamic", "data": { "provider": "code.extension" } }
    },
    {
      "long": "--list-extensions",
      "description": "List installed extensions"
    },
    {
      "long": "--show-versions",
      "description": "Show extension versions"
    },
    {
      "long": "--enable-proposed-api",
      "description": "Enable proposed API"
    },
    {
      "short": "-v",
      "long": "--version",
      "description": "Show version"
    },
    {
      "short": "-h",
      "long": "--help",
      "description": "Show help"
    },
    {
      "long": "--user-data-dir",
      "description": "User data directory",
      "takes_value": true,
      "value_type": { "type": "Directory" }
    },
    {
      "long": "--extensions-dir",
      "description": "Extensions directory",
      "takes_value": true,
      "value_type": { "type": "Directory" }
    },
    {
      "long": "--locale",
      "description": "Set locale",
      "takes_value": true
    },
    {
      "long": "--disable-extensions",
      "description": "Disable all extensions"
    },
    {
      "long": "--disable-gpu",
      "description": "Disable GPU acceleration"
    }
  ],
  "arguments": [
    {
      "name": "file_or_folder",
      "description": "File or folder to open",
      "type": {
        "type": "File",
        "data": {}
      }
    }
  ]
}
